{"schemaVersion":"1.0.0","id":"ncom-validated-commands","frameworkId":"ncom","type":"validated_command","title":"NCom validated install and build commands","summary":"配置驱动的 install、lint 与 build 基线步骤。","status":"active","scope":{"exactCommits":["a350b576bbeae6c6254273037a17d2a8730fb80f"],"commitRange":null,"branch":null,"os":["win32"],"architecture":["x64"],"nodeVersion":"v24.18.0","packageManager":{"name":"pnpm","version":"10.26.1"},"frameworkVersion":"0.0.8","validFrom":null,"validUntil":null,"scopeUnknown":false},"claims":[{"id":"baseline-commands","text":"基线依次运行 pnpm install --frozen-lockfile、lint:eslint 和 build。","status":"verified","evidence":[{"id":"commands-config","type":"framework_config","path":"frameworks/ncom/framework.yaml","jsonPointer":null,"runId":null,"stepId":null,"eventId":null,"commit":"a350b576bbeae6c6254273037a17d2a8730fb80f","lineStart":10,"lineEnd":26,"sha256":"f527d5b9c0a28110c597485de3505d46c53cf3c8843c055cde284d620ff76cf1","note":null}]}],"limitations":["lint 在 Run 009/010 中仍失败并被配置为 allow_failure。"],"tags":["command","install","lint","build"],"createdAt":"2026-07-23T03:20:00.000Z","updatedAt":"2026-07-23T03:20:00.000Z","supersedes":[],"supersededBy":[]}
