{"schemaVersion":"1.0.0","id":"ncom-framework-overview","frameworkId":"ncom","type":"framework_overview","title":"NCom framework overview","summary":"Framework Lab 当前将 NCom 作为单一真实基线对象。","status":"active","scope":{"exactCommits":["a350b576bbeae6c6254273037a17d2a8730fb80f"],"commitRange":null,"branch":"main","os":[],"architecture":[],"nodeVersion":null,"packageManager":null,"frameworkVersion":"0.0.8","validFrom":null,"validUntil":null,"scopeUnknown":false},"claims":[{"id":"configured-object","text":"Framework Lab 配置中的框架 id 为 ncom，名称为 New Component。","status":"observed","evidence":[{"id":"overview-config","type":"framework_config","path":"frameworks/ncom/framework.yaml","jsonPointer":null,"runId":null,"stepId":null,"eventId":null,"commit":"a350b576bbeae6c6254273037a17d2a8730fb80f","lineStart":1,"lineEnd":6,"sha256":"f527d5b9c0a28110c597485de3505d46c53cf3c8843c055cde284d620ff76cf1","note":null}]}],"limitations":["本卡不描述未由现有证据验证的 NCom 架构或 API。"],"tags":["ncom","overview"],"createdAt":"2026-07-23T03:20:00.000Z","updatedAt":"2026-07-23T03:20:00.000Z","supersedes":[],"supersededBy":[]}
