{"schemaVersion":"1.0.0","id":"ncom-run009-cjk-sass-issue","frameworkId":"ncom","type":"known_issue","title":"Run 009 CJK Sass import failure","summary":"原始 worktree 在记录环境中构建被 Sass import failure 阻塞。","status":"active","scope":{"exactCommits":["a350b576bbeae6c6254273037a17d2a8730fb80f"],"commitRange":null,"branch":null,"os":["win32"],"architecture":["x64"],"nodeVersion":"v24.18.0","packageManager":{"name":"pnpm","version":"10.26.1"},"frameworkVersion":"0.0.8","validFrom":null,"validUntil":null,"scopeUnknown":false},"claims":[{"id":"sass-blocker","text":"Run 009 的首个阻塞错误是 Sass “Can't find stylesheet to import.”，位置为 packages/components/src/alert/style.scss:1:1。","status":"observed","evidence":[{"id":"run009-sass-event","type":"run_error","path":"frameworks/ncom/runs/run-009/errors.json","jsonPointer":"/events/47","runId":"run-009","stepId":"build","eventId":"error-3505c778db1c","commit":"a350b576bbeae6c6254273037a17d2a8730fb80f","lineStart":null,"lineEnd":null,"sha256":"954792c91f94bf29c6af8ca1c26d27c376e8f16e535b83bcf23f7620ad8b5fe4","note":"本地 Run 被 Git 忽略。"}]}],"limitations":["只在记录的 Windows 10 环境与该精确 commit 上观察到；不外推到所有 Windows 或 CJK 路径。"],"tags":["sass","cjk","build","run-009"],"createdAt":"2026-07-23T03:20:00.000Z","updatedAt":"2026-07-23T03:20:00.000Z","supersedes":[],"supersededBy":[]}
