{"schemaVersion":"1.0.0","id":"ncom-run010-verified-patch","frameworkId":"ncom","type":"verified_patch","title":"Run 010 verified CJK Sass patch","summary":"单文件补丁移除 additionalData 后 build 在相同记录环境通过。","status":"active","scope":{"exactCommits":["a350b576bbeae6c6254273037a17d2a8730fb80f"],"commitRange":null,"branch":null,"os":["win32"],"architecture":["x64"],"nodeVersion":"v24.18.0","packageManager":{"name":"pnpm","version":"10.26.1"},"frameworkVersion":"0.0.8","validFrom":null,"validUntil":null,"scopeUnknown":false},"claims":[{"id":"patch-content","text":"候选补丁只修改 packages/all/build/shared.ts，移除 createStyleConfig 的 additionalData。","status":"verified","evidence":[{"id":"cjk-patch","type":"patch","path":"frameworks/ncom/patches/ISSUE-NCOM-CJK-SASS-001.patch","jsonPointer":null,"runId":null,"stepId":null,"eventId":null,"commit":"a350b576bbeae6c6254273037a17d2a8730fb80f","lineStart":1,"lineEnd":28,"sha256":"e4c0112fd30ac7ca2e701fa2793cbe55f1e641dbf75bb07cf57a00e1c7f3b81d","note":null}]},{"id":"build-passed-lint-failed","text":"Run 010 的 build passed，lint 仍 failed 且最终状态为 partial。","status":"verified","evidence":[{"id":"run010-result","type":"run","path":"frameworks/ncom/runs/run-010/run.json","jsonPointer":"/steps","runId":"run-010","stepId":"build","eventId":null,"commit":"a350b576bbeae6c6254273037a17d2a8730fb80f","lineStart":null,"lineEnd":null,"sha256":"3fc675efc6117ec5b96b03846ed4f5f6632826f13b0d46d824dd786e4a037617","note":"本地 Run 被 Git 忽略。"}]}],"limitations":["lint 仍失败。","浏览器与功能回归未验证。","不声明上游已修复或补丁适用于所有版本。"],"tags":["patch","sass","cjk","run-010","build"],"createdAt":"2026-07-23T03:20:00.000Z","updatedAt":"2026-07-23T03:20:00.000Z","supersedes":[],"supersededBy":[]}
