{"schemaVersion":"1.0.0","id":"framework-lab-evidence-preservation","frameworkId":"ncom","type":"workflow_constraint","title":"Isolated worktree and evidence preservation constraint","summary":"修复候选必须隔离，历史 Run 与原始日志必须保留。","status":"active","scope":{"exactCommits":["a350b576bbeae6c6254273037a17d2a8730fb80f"],"commitRange":null,"branch":null,"os":[],"architecture":[],"nodeVersion":null,"packageManager":null,"frameworkVersion":"0.0.8","validFrom":null,"validUntil":null,"scopeUnknown":false},"claims":[{"id":"isolated-worktree","text":"Run 009 与 Run 010 对照使用原始和独立候选 worktree，历史证据不得由候选修复覆盖。","status":"manual","evidence":[{"id":"comparison-report","type":"comparison_report","path":"frameworks/ncom/reports/run-009-vs-run-010-cjk-sass-fix.md","jsonPointer":null,"runId":null,"stepId":null,"eventId":null,"commit":"a350b576bbeae6c6254273037a17d2a8730fb80f","lineStart":1,"lineEnd":68,"sha256":"789b3bd546af7c8e8be24a6eed81e73f82ebb79f362d11ec4a1d9999265e01ca","note":null}]}],"limitations":["该约束描述 Framework Lab 本次受控工作流，不代表 NCom 上游流程。"],"tags":["workflow","worktree","evidence","constraint"],"createdAt":"2026-07-23T03:20:00.000Z","updatedAt":"2026-07-23T03:20:00.000Z","supersedes":[],"supersededBy":[]}
