{"schemaVersion":"1.0.0","id":"ncom-supported-environment","frameworkId":"ncom","type":"environment_requirement","title":"NCom supported environment baseline","summary":"Run 009/010 使用的已记录 Windows 与 Node/pnpm 环境。","status":"active","scope":{"exactCommits":["a350b576bbeae6c6254273037a17d2a8730fb80f"],"commitRange":null,"branch":null,"os":["win32"],"architecture":["x64"],"nodeVersion":"v24.18.0","packageManager":{"name":"pnpm","version":"10.26.1"},"frameworkVersion":"0.0.8","validFrom":null,"validUntil":null,"scopeUnknown":false},"claims":[{"id":"run-environment","text":"受控 Run 使用 win32 10.0.19045 x64、Node v24.18.0、npm 11.7.0 和 pnpm 10.26.1。","status":"verified","evidence":[{"id":"env-run010","type":"run","path":"frameworks/ncom/runs/run-010/environment.json","jsonPointer":"","runId":"run-010","stepId":null,"eventId":null,"commit":"a350b576bbeae6c6254273037a17d2a8730fb80f","lineStart":null,"lineEnd":null,"sha256":"3230b372ea0c44d5b804efb33a35ba4f1d1525c8270a23c7174e827a542fe6b5","note":"本地 Run 被 Git 忽略。"}]}],"limitations":["该环境记录不证明其他 Windows、Node 或 pnpm 组合等价。"],"tags":["environment","windows","node","pnpm"],"createdAt":"2026-07-23T03:20:00.000Z","updatedAt":"2026-07-23T03:20:00.000Z","supersedes":[],"supersededBy":[]}
